Document Name,Cleaned Text,Data Source
20240301-Media-Release-Establishment-of-Future-Energy-Fund-to-Support-Singapores-Infrastructure-Investments.pdf.coredownload.pdf,p r e s s establishment future energy fund r support singapore infrastructure investment e l power generation account singapore emission e today electricity generate natural gas decarbonise power sector import electricity region explore s low carbon alternative hydrogen e global energy transition fossil fuel low carbon energy complex process require significant investment country singapore challenge lack domestic renewable energy resource imperative plan ahead set aside resource singapore energy transition include new infrastructure depend technological development government set future energy fund support infrastructure investment energy transition net zero future project involve nascent technology require high upfront capital expenditure furthermore expose significant commercial geopolitical risk establishment future energy fund ensure government ready provide financial support catalyse energy transition project secure low carbon energy supply meet singapore decarbonisation ambition well prepare business economy low carbon future allow singapore remain attractive investment destination example energy transition infrastructure support future energy fund include undersea cable import low carbon electricity new hydrogen terminal pipeline decide adopt scale use hydrogen infrastructure need meet goal sustainability long term economic competitiveness continue safeguard energy security future energy fund establish end amendment relevant legislation ministry trade industry energy market authority singapore,https://www.ema.gov.sg/content/dam/corporate/news/media-releases/2024/20240301-Media-Release-Establishment-of-Future-Energy-Fund-to-Support-Singapores-Infrastructure-Investments.pdf.coredownload.pdf
annex-ac01d83c960d94cf5975d73d55479b919.pdf,annex initiative target singapore green plan s n initiative target city nature city nature target green space park connector double annual tree add ha green space planting rate ha new nature plant million park new nature park tree singapore provide recreational option increase nature park land hiking birdwatching area protect nature reserve baseline urbanisation household add km park connector walk park ii naturalise park urban infrastructure provide shade cool target environment improve air quality add ha green space beautify city incorporate natural design plant ha park garden restore enhance ha forest marine coastal habitat add ha skyrise greenery km nature way road sustainable live green citizenry consume target reduce waste waste landfill capita encourage water conservation day water efficient practice household industry target shower fitting replacement reduce household water climate friendly household consumption litre programme caput day mandatory water efficiency label reduce waste scheme landfill capita day ii reduce reuse recycle norm citizen business national strategy address e waste packaging waste food waste b green commute target expand rail network new station achieve mass public line open year transport rail bus decade modal share ii purchase clean energy public expand rail network bus go forward km today km iii encourage walk cycling early expand cycling network triple cycling path km repurpose road active mobility use km possible iv develop new town concept tengah car free hdb town centre c strengthen green effort school target enhance integration achieve third reduction environmental sustainability school net carbon emission strengthen building inform school sector responsible sustainability conscious school mindset habit student carbon neutral eco stewardship programme ii reduce net carbon emission school sector iii start school achieve carbon neutrality rest follow energy reset green energy play active important role promote sustainable fuel fulfil international international trade travel goal ii increase solar deployment singapore o international civil deployment energy aviation organisation storage address solar intermittency aspirational goal enhance grid resilience support annual fuel efficiency transition green energy mix improvement iii increase efficiency new carbon neutral generation gas fire power plant growth reduce carbon emission adopt o international maritime new advanced combine cycle gas organisation target turbine reduce greenhouse gas iv green singapore electricity supply ghg emission tap low carbon potential international shipping clean electricity import compare level phase ghg emission century target increase solar energy deployment fold gwp meet project electricity demand generate electricity power household year gwp meet project electricity demand generate electricity power household year mw energy storage system deployment power household day well class generation technology meet rate emission standard reduce carbon emission diversify electricity supply clean electricity import b greener infrastructure building target raise sustainability standard green singapore building singapore green building gross floor building masterplan pave way area low carbon build environment raise minimum energy target pub generate performance requirement sufficient solar energy review green mark scheme float solar panel power push adoption singapore waterworks low energy building sleb support development target energy efficient cost effective reduce energy consumption green technology desalination process ii improve energy efficiency water current m kwh m treatment research singapore integrate development waste water investment desalination treatment facility water treatment technology energy self sufficient tuas electrochemical nexus desalination step feed membrane bioreactor long term target reduce iii reduce carbon footprint water desalination energy production adoption kwh m renewable solar energy iv improve energy resource efficiency water treatment plant c sustainable town district target reduce energy hdb green town consumption exist hdb programme town introduce smart lead lighting use energy normal lead lighting double total solar capacity hdb rooftop megawatt peak mwp today mwp increase number hdb rooftop solar panel pilot urban water harvesting system uwhs recycle rainwater non potable use help mitigate flood risk release stormwater slow rate pilot test effectiveness cool paint reduce ambient temperature convert deck suitable storey carpark urban farm community garden extensive greenery increase green cover enhance liveability ii new hdb town green sustainable tengah town centralised cooling system iii develop jurong lake district model sustainable mixed use district district cooling solar power deployment super low energy building d clean energy vehicle target require new registration new car registration clean energy model clean energy model ii build ev charge infrastructure double national support growth evs ev charge point target iii revise vehicle tax structure charge easy buy evs point green economy new investment well seek new investment class good class ensure new carbon intensive carbon efficiency investment bring singapore good class term carbon energy efficiency carbon intensive sector ii review carbon tax b sustainability new engine job target growth jurong island green industry production sustainable energy process energy usage chemical park transform jurong island singapore sustainable sustainable energy chemical park tourism destination improve industry energy singapore lead centre efficiency green finance service ii develop singapore sustainable facilitate asia transition tourism destination low carbon sustainable iii develop singapore carbon future service hub requisite singapore carbon capability network service hub asia value chain singapore lead iv develop singapore lead centre regional centre develop green finance asia globally support sustainable singapore new sustainability solution facilitate asia transition groom strong pool local sustainable future enterprise capture strengthen singapore vibrant sustainability opportunity location global local company develop new sustainability solution asia enabler area sustainable packaging decarbonisation waste upcycling urban farming water treatment vi develop trial new technology carbon capture utilisation storage vii study potential low carbon hydrogen emerge technology pathway decarbonisation viii support local enterprise adopt sustainability standard enhance resource include energy efficiency capture new business opportunity sustainability resilient future adapt sea level rise enhance flood target complete formulation resilience engineering design well understand sea level rise implementation plan coastal projection technology modelling adaptation measure city east manage inland coastal flood risk coast northwestern coast lim holistically chu kang sungei kadut ii site specific study assess jurong island provide detail coastal adaptation measure implement iii sustainable reliable funding pool coastal flood protection b singapore cool target determine deploy sensor understand urban heat study island effect singapore implement uhi mitigation measure c grow local target meet avail space infrastructure singapore nutritional need agriculture aquaculture enhance locally produce food funding support incentivise agri food industry adopt highly productive climate resilient resource efficient farming technology develop local pipeline skilled worker agri food sector ii conduct singapore food story programme promote refer green energy low carbon solution application industry power generation research innovation plug exist technological gap theme theme sustainable urban food production theme future food advanced biotech base protein production theme food safety science innovation,https://assets-global.website-files.com/5e940b86961046721a7e92b5/65483f2f82d5096bc453cadf_mapping%20green%20plan%20targets.pdf
cptpp-eng-formatted-002.pdf,comprehensive progressive agreement trans pacific partnership preamble party agreement resolve reaffirm matter embody preamble trans pacific partnership agreement auckland february hereinafter refer tpp realise expeditiously benefit tpp agreement strategic economic significance contribute maintain open market increase world trade create new economic opportunity people income economic background promote regional economic integration cooperation enhance opportunity acceleration regional trade liberalisation investment reaffirm importance promote corporate social responsibility cultural identity diversity environmental protection conservation gender equality indigenous right labour right inclusive trade sustainable development traditional knowledge importance preserve right regulate public interest andwelcome accession state separate custom territory agreement agree follow article incorporation trans pacific partnership agreement party agree term agreement provision trans pacific partnership agreement auckland february tpp incorporate reference agreement mutatis mutandis article accession article entry force article withdrawal article authentic text purpose agreement reference date signature tpp shall mean date signature agreement event inconsistency agreement tpp force agreement shall prevail extent inconsistency article suspension application certain provision date entry force agreement party shall suspend application provision set annex agreement party agree end suspension provision great certainty agreement shall provide right non party agreement great certainty agreement party end suspension shall apply party completion party applicable legal procedure article entry force agreement shall enter force day date cent number signatory agreement whichever small notify depositary writing completion applicable legal procedure signatory agreement agreement enter force paragraph agreement shall enter force day date signatory notify depositary writing completion applicable legal procedure article withdrawal party withdraw agreement provide write notice withdrawal depositary withdraw party shall simultaneously notify party withdrawal overall contact point designate article contact point tpp withdrawal shall effect month party provide write notice depositary paragraph party agree different period party withdraw agreement shall remain force remain party article accession date entry force agreement state separate custom territory accede agreement subject term condition agree party state separate custom territory article review comprehensive progressive agreement trans pacific partnership article function commission tpp entry force tpp imminent tpp unlikely enter force party shall request party review operation agreement consider amendment agreement related matter article authentic text english spanish french text agreement equally authentic event divergence text english text shall prevail witness whereof undersigned duly authorise respective government sign agreement santiago eighth day march thousand eighteen english french spanish language annex chapter customs administration trade facilitation article express shipment paragraph subparagraph f second sentence chapter investment article definition definition investment agreement include footnote ii definition investment authorisation include footnote b article submission claim arbitration paragraph subparagraph include footnote b subparagraph c subparagraph d subparagraph assist understanding annex party colon indicate specific provision suspend e chaussette provide claimant submit pursuant subparagraph claim breach investment agreement subject matter claim claim damage directly relate cover investment establish acquire seek establish acquire reliance relevant investment agreement ii paragraph paragraph include footnote iii paragraph subparagraph b phrase investment authorisation investment agreement c article selection arbitrator paragraph d article govern law paragraph include footnote e annex investment agreement annex chapter cross border trade service annex express delivery service paragraph include footnote b paragraph include footnote chapter financial service article scope paragraph subparagraph b phrase article minimum standard treatment include footnote b annex annex chapter telecommunications article resolution telecommunication dispute paragraph subparagraph d include head reconsideration footnote chapter government procurement article condition participation paragraph include footnote b article negotiation paragraph phrase later year date entry force agreement chapter intellectual property article national treatment sentence footnote b article patentable subject matter paragraph paragraph ii paragraph sentence c article patent term adjustment unreasonable grant authority delay article include footnote d article patent term adjustment unreasonable curtailment article include footnote party agree negotiation refer paragraph article negotiation shall commence early year entry force agreement party agree negotiation shall commence request party e article protection undisclosed test datum article include footnote f article biologic article include footnote g article term protection copyright related right article include footnote h article technological protection measure tpm article include footnote article right management information rmi article include footnote j article protection encrypted program carry satellite cable signal article include footnote k article legal remedy safe harbour article include footnote l annex annex section j annex m annex annex section j annex chapter environment article conservation trade paragraph phrase applicable law include footnote chapter transparency anti corruption annex transparency procedural fairness pharmaceutical product medical device article procedural fairness include footnote annex ii schedule brunei darussalam paragraph phrase signature agreement annex iv schedule malaysia scope non conforming activity hereinafter refer scope reference phrase signature agreement result suspension party agree phrase signature agreement shall refer entry force agreement brunei darussalam party understand reference non conforming measure adopt maintain paragraph shall mean non conforming measure adopt maintain date entry force agreement brunei darussalam result suspension party agree phrase signature agreement shall refer entry force agreement malaysia party understand reference scope year shall year period b second year shall second year period c fourth year shall fourth year period d fifth year shall fifth year period e sixth year shall sixth year period count date entry force agreement malaysia,https://investmentpolicy.unctad.org/international-investment-agreements/treaties/treaties-with-investmentprovisions/5074/comprehensive-and-progressive-agreement-for-trans-pacific-partnership-cptpp-2018-
