Document Name,Cleaned Text,Data Source
ading exist partnership identify context dense urban population finance ecosystem low carbon new partner include international high humidity manage hydrogen hydrogen support development organisation ammonia deployment safely global trading market second advance clear priority molecule undertake low carbon hydrogen give nascency hydrogen prepare long term deployment deploy trade meaningful supply chain expect build build experience long term scale new infrastructure need significant infrastructure finding pathfinder land build include import term expect careful study safety land use storage facility distribution network land planning require include requirement hydrogen work infrastructure infrastructure new end use possible offshore solution give industry develop plan gradually planning application power generation significant footprint supply chain build necessary infrastructure unit bunker jetty support workforce train development broad hydrogen economy rise significant global government work hydrogen economy open industry union education sector opportunity singapore support workforce development enterprise worker position equip singaporeans skill international financial business knowledge need thrive trading hub stand good hydrogen economy wish stead grow hydrogen service particular look forward hub example pathfinder uncover global company establish new capability require domestic hydrogen relate business unit end use sector early intervention singapore tap deep systematic training worker international regional network successfully pick new efficient business infrastructure skill require strong innovation ecosystem attract company look provide hydrogen base technological solution region addition adoption low carbon hydrogen end use sector require upskille reskille workforce particular worker energy chemical chemical storage marine bunkering power generation aviation sector need new skill hydrogen supply chain develop hydrogen start sector singapore commit strong international partnership combat climate change crucial enabler decarbonise domestic emission able successfully journey play catalytic role internationally operable guarantee decarbonise international maritime origin certification methodology aviation sector emission intensity standard critical facilitate international trade view low carbon hydrogen hydrogen global acceptability carrier form broad base decarbonisation tool country scalable decarbonisation pathway commitment allow free trading singapore world give low carbon hydrogen carrier form uncertainty global supply chain important build confidence key technology market end user limit size calibrated progressive approach develop journey ahead important domestic infrastructure deployment exciting singapore welcome idea focus seed pathfinder suggestion industry project build capability international partner regulatory agency industry well navigate low carbon workforce undertake long term hydrogen future build infrastructure workforce planning sustainable world generation prepared scale come deployment tandem global technological development invest research innovation solve key technological bottleneck relevant singapore facilitate commercialisation research outcome c o n c l u s o n ministry trade industry singapore publish october,,https://www.iea.org/policies?qs=singapore&country%5B0%5D=Singapore
Energy Reset.pdf,energy reset city nature energy reset home key focus area energy reset green economy enerregsilieynt frutureeset sustainable living energy reset energy reset energy reset pillar aim use clean energy source sector continue maximise need c h energy reset city nature energy reset green economy resilient future sustainable live green energy solar energy remain promising renewable energy source singapore come electricity generation today singapore solar dense city world peak inland solar photovoltaic system tengeh reservoir size football continue maximise need c h energy reset city nature energy reset green economy resilient future sustainable living continue maximise solar panel deployment include rooftop reservoir open space aim peak solar energy deployment generate energy meet annual electricity need household solar power output intermittent nature subject weather condition maintain grid reliability singapore deploy energy storage system ess address solar intermittency enhance grid resilience february singapore launch megawatt hour ess jurong island large ess southeast asia commission month fast world size deploy continue maximise need c h energy reset city nature energy reset green economy resilient future sustainable living image credit sembcorp industry regional power grid allow access clean energy source border aim import gigawatt low carbon electricity singapore project electricity supply singapore explore emerge low carbon alternative hydrogen geothermal carbon capture utilisation storage october announce national hydrogen strategy develop hydrogen major decarbonisation pathway plan increase power plant reduce emission continue maximise need c h energy reset green transport city nature transport system grow capacity usage increasingly important manage energy reset environmental footprint vision green evceohniocmley run clean energy resilient future continue reduce sector emission encourage use public transport active sustainable living mobility transition clean energy vehicle population new diesel car taxi registration cease new car tax registration clean energy model target electric vehicle ev charge point tandem ev adoption hdb town ev ready fast charger deploy support charge need ev driver position seize growth opportunity aviation maritime air sea hub run clean energy reduce domestic emission sector recent launch sustainable air hub blueprint detail new air hub target include achieve net zero domestic international aviation carbon continue maximise need c h energy reset emission domestic aviation emission airport operation reduce city nature level energy reset green building green economy resilienbt ufuiltduirneg account singapore emission green building key sustainable living strategy achieve sustainability ambition singapore green plan international commitment climate change support sdgs previous city nature green economy singapore green plan key pillar key action late news enabler overview continue maximise need c h,"https://www.greenplan.gov.sg/key-focus-areas/energy-reset/#:~:text=Green%20Energy&text=We%20will%20continue%20to%20maximise,needs%20of%20around%20350%2C000%20h"
MTI Press Release on Singapore To Develop Hydrogen As A Pathway to Accelerate Transition To Net.pdf,p r e s immediate reporting s r singapore launch national hydrogen strategy accelerate transition net zero emission e strengthen energy security l e hydrogen supply half power need s deputy prime minister minister finance lawrence wong e outline singapore national strategy develop hydrogen major decarbonisation pathway support singapore international climate commitment achieve net zero emission dpm wong speak today singapore energy lecture mark start singapore international energy week hydrogen key potential decarbonisation pathway singapore government study decarbonisation pathway achieve net zero emission strengthen energy security low carbon hydrogen include derivative ammonia emerge key potential pathway singapore hydrogen potential adopt different sector low carbon fuel feedstock hydrogen release greenhouse gas combust produce emission method electrolysis water renewable energy close zero emission singapore hydrogen complement diversify power mix alongside solar import electricity potential low carbon energy source geothermal energy depend technological development development energy source hydrogen supply half power need play important role decarbonise industry domestic emission low carbon hydrogen derive fuel potential alternative fossil fuel maritime aviation sector busy container transshipment port lead air hub world singapore catalyst global transition greener shipping aviation advance singapore hydrogen journey hydrogen technology development global supply chain establish strong interest internationally public private sector accelerate development hydrogen value chain evidence grow pipeline production project worldwide active industry research effort hydrogen technology p r e s immediate reporting s r singapore step prepare hydrogen deployment domestically work partner build hydrogen supply chain asia e national hydrogen strategy comprise key thrust l e experiment use advanced hydrogen technology cusp commercial readiness regard s launch expression interest small scale commercial project e utilise ammonia power generation include develop ammonia supply chain support marine bunkering need project allow assess viability ammonia hydrogen carrier direct fuel develop regulation ecosystem support detail release come month second conduct research development work advance hydrogen technology hydrogen key focal area phase low carbon energy research lcer programme october award million project phase programme research low carbon technology million set aside phase collaboration academia industry aim unlock key technological bottleneck singapore able import handle utilise low carbon hydrogen derivative safely scale government work closely industry international partner enable formation scale supply chain low carbon hydrogen include advance development guarantee origin certification methodology ensure methodology interoperable jurisdiction build trading financing ecosystem facilitate global trade low carbon hydrogen fourth mass deployment hydrogen require new infrastructure import store transform hydrogen power develop land infrastructure plan pace implementation accordingly fifth adoption hydrogen bring new economic opportunity singapore enterprise worker opportunity abound hydrogen supply chain financing trading certify transporting storage deployment work industry education sector support workforce training singaporeans good stead capture new opportunity global hydrogen economy information singapore national hydrogen strategy find ministry trade industry singapore october p r e s immediate reporting s r medium query contact e l e sarah wong assistant director communication engagement division email s e delia wu senior assistant director communication engagement division email,https://www.mti.gov.sg/-/media/MTI/Newsroom/Press-Releases/2022/10/MTI-Press-Release-on-Singapore-To-Develop-Hydrogen-As-A-Pathway-to-Accelerate-Transition-To-Net.pdf
Singapores Approach To Alternative Energy.pdf,singapore approach alternative energy home singapore climate action national circumstance singapore singapore approach alternative energy singapore approach alternative energy singapore approach alternative energy small resource constrain country singapore import energy need limit renewable energy option commercial wind turbine operate wind speed s average wind speed singapore m singapore approach alternative energy singapore relatively narrow tidal range calm sea limit opportunity commercial tidal power generation sea space port anchorage shipping lane limit application ocean energy technology hydroelectric power harness singapore river system fast water year geothermal energy source adequate near surface underground geothermal energy source singapore conventional geothermal system deployment small physical size sq km high population density land scarcity limit potential sustainably grow domestic biomass constrain safe deployment nuclear power singapore singapore approach alternative energy solar panel marina barrage image courtesy pub singapore national water agency singapore high average annual solar irradiation kwh m make solar photovoltaic pv national potential renewable energy option singapore circumstance face challenge use solar overview energy singapore limit available land singapore large scale deployment solar panel approach addition presence high cloud cover alternative singapore urban shading pose challenge energy intermittency impact climate limited renewable energy option available change current technological capability singapore able generate baseload electricity renewable source reliably singapore singapore singapore aim deploy climate singapore approach alternative energy target gigawatt peak solar energy equivalent power international household year effort singapore invest research development mitigation test bed improve performance effort solar pv system develop innovative way adaptation intergrate solar energy system urban effort environment test bed project include green growth housing development board initiative opportunity install solar panel rooftop high rise public housing development economic development board pub pv project pilot solar panel installation water surface reservoir singapore focus research test bed improve performance solar system develop innovative way integrate solar energy system urban environment effort continually explore new option energy supply enhance energy security singapore explore variety different option include regional power grid emerge low carbon alternative singapore approach alternative energy carbon hydrogen carbon capture utilisation storage exist technology nuclear viable today continue monitor progress nuclear energy technology build capability well understand nuclear science technology new development geothermal technology potential harness heat deep underground power generation new geothermal technology harness heat great depth commercially deploy immediate plan geothermal energy production singapore previous overview impact climate change singapore national climate change secretariat singapore medium public climate climate consultatio change action n nccs overview,https://www.nccs.gov.sg/singapores-climate-action/singapore-approach-to-alternative-energy/
Solar _ EMA.pdf,solar overview facilitate deployment overcome intermittency relate link ema work closely industry government agency maximise solar deployment mitigate challenge face harnessing solar energy overview lot sunshine singapore solar energy promising renewable energy source goal achieve gigawatt peak gwp instal solar capacity meet annual electricity need household facilitate deployment ema collaborate government agency industry maximise solar deployment innovative method rooftop solarnova programme government effort aggregate demand solar pv system government agency include instal system rooftop hdb flat public sector building factor sunlight intensity cloud cover shade affect output solar share solar energy mix increase fluctuation solar output affect stability power grid reservoir offshore space solar panel span land area football field megawatt peak mwp sembcorp tengeh float solar farm world large inland float solar pv solar pv system find offshore space sunseap edpr mwp solar farm woodland solar farm expect produce estimate kilo watt hour kwh energy year temporary vacant land solarland programme jtc involve instal modular solar pv system temporary vacant land solar pv system currently find jurong island changi business park building build integrate solar photovoltaic bipv refer seamless integration solar pv system design building roof facade window offer sustainable visually appealing solution clean energy generation building addition regularly review introduce policy improvement facilitate deployment solar energy intermittency pricing mechanism intermittency pricing mechanism ipm allow price generate electricity adjust base real time availability intermittent generation source solar adjustment ensure cost reserve regulation charge generation source allocate fairly make solar deployment sustainable way power generation solar aggregator model model solar aggregator like solar leasing company receive consolidated export payment meter datum sp group streamline administrative process payment datum management solar deployment master sub setup ema actively address constraint face owner landlord building master sub scheme instance explore option enable contestable pay excess solar power sell grid empower benefit solar installation contribute sustainable energy future currently physical work solution connect solar pv system directly substation connect solar pv main switchboard consumer main switchboard connect grid feasible building refer term condition solution nomination party receive direct payment sp groupthis involve allow party receive direct payment sp group behalf solar company consumer solar installation arrangement find administratively easy solar installation solar leasing model allow consumer multiple embed generation unit leasing company site current system design sp group billing system permit payment single leasing company enhancement implement consumer flexibility engage multiple lessor enable explore different technology option site lease different entity overcome intermittency intermittent energy source tap solar come set challenge limited land space carefully consider land set aside solar installation versus compete use like recreational activity reservoir factor sunlight intensity cloud cover shade affect output solar share solar energy mix increase fluctuation solar output affect stability power grid mitigate solar intermittency essential reason stable reliable electricity supply vital meet energy demand home business industry fluctuation solar output disrupt balance electricity supply demand cause disruption grid instability smooth solar power intermittency enhance grid stability minimise voltage fluctuation frequency deviation improve overall power quality reduce solar generation variability vital integrate renewable energy source effectively enable well integration energy source create reliable diverse energy mix follow award million research grant consortium lead national university singapore ema successfully test solar forecasting model able anticipate solar power output advance proactively address solar intermittency addition model technology like energy storage system manage solar irradiance measurement instrument instal building rooftop photo courtesy solar energy research institute singapore seris relate link consumer information solar installation,https://www.ema.gov.sg/content/dam/corporate/partnerships/proposals/request-for-proposal-to-build-own-and-operate-new-generation-capacity-2024/EMA-Proposals-RFP-for-New-Generation-Capacity-in-2029-20240604.pdf.coredownload.pdf
